{
  "layer_id": "caudais-rios",
  "published_at": "2026-10-25T23:50:00.000Z",
  "fetched_at": "2026-10-26T00:11:48.402Z",
  "last_success_at": "2026-10-26T00:11:48.402Z",
  "status": "fresh",
  "consecutive_failures": 0,
  "feature_count": 87,
  "source_url": "https://servizos.meteogalicia.gal/mgafos/json/estadoActual.action",
  "licence": "https://www.meteogalicia.gal/web/aviso-legal",
  "attribution": "Datos: Augas de Galicia e MeteoGalicia (Xunta de Galicia). Datos non validados.",
  "checksum": "sha256:327d786745b097920920238350cbd8f3b0813cf506cba4e4924b16e14eacb11f",
  "last_error": null,
  "history": [
    {
      "at": "2026-10-26T00:11:48.402Z",
      "ok": true
    },
    {
      "at": "2026-10-25T22:05:42.768Z",
      "ok": true
    },
    {
      "at": "2026-10-25T19:40:42.158Z",
      "ok": true
    },
    {
      "at": "2026-10-25T18:28:23.119Z",
      "ok": true
    },
    {
      "at": "2026-10-25T17:15:27.577Z",
      "ok": true
    },
    {
      "at": "2026-10-25T14:38:46.460Z",
      "ok": true
    },
    {
      "at": "2026-10-25T13:48:36.552Z",
      "ok": true
    },
    {
      "at": "2026-10-25T12:29:35.349Z",
      "ok": true
    },
    {
      "at": "2026-10-25T11:34:28.883Z",
      "ok": true
    },
    {
      "at": "2026-10-25T11:26:40.173Z",
      "ok": true
    },
    {
      "at": "2026-10-25T11:11:29.015Z",
      "ok": true
    },
    {
      "at": "2026-10-25T09:22:12.715Z",
      "ok": true
    },
    {
      "at": "2026-10-25T04:31:36.351Z",
      "ok": true
    },
    {
      "at": "2026-10-25T00:05:39.642Z",
      "ok": true
    },
    {
      "at": "2026-10-24T21:59:35.442Z",
      "ok": true
    },
    {
      "at": "2026-10-24T19:50:14.905Z",
      "ok": true
    },
    {
      "at": "2026-10-24T17:44:07.459Z",
      "ok": true
    },
    {
      "at": "2026-10-24T14:50:32.129Z",
      "ok": true
    },
    {
      "at": "2026-10-24T11:32:19.469Z",
      "ok": true
    },
    {
      "at": "2026-10-24T09:06:39.146Z",
      "ok": true
    },
    {
      "at": "2026-10-24T07:54:24.928Z",
      "ok": true
    },
    {
      "at": "2026-10-24T07:32:37.881Z",
      "ok": true
    }
  ]
}
