{
  "layer_id": "entidades-poboacion",
  "published_at": "2025-11-30T23:00:00.000Z",
  "fetched_at": "2026-10-25T09:58:45.193Z",
  "last_success_at": "2026-10-25T09:58:45.193Z",
  "status": "fresh",
  "consecutive_failures": 0,
  "feature_count": 41,
  "source_url": "https://ideg.xunta.gal/servizos/rest/services/PBA/EntidadesPoboacion_PBA/MapServer/0/query",
  "licence": "CC-BY-SA-4.0",
  "attribution": "© Instituto de Estudos do Territorio. Xunta de Galicia (PBA)",
  "checksum": "sha256:7e4fdd7f0cb378f173d43b959c082f27167e47776f9e564ef99d1c190edd7e58",
  "last_error": null,
  "history": [
    {
      "at": "2026-10-25T09:58:45.193Z",
      "ok": true
    }
  ]
}
