{
  "layer_id": "concellos-parroquias",
  "published_at": "2026-01-31T23:00:00.000Z",
  "fetched_at": "2026-10-25T10:59:25.123Z",
  "last_success_at": "2026-10-25T10:59:25.123Z",
  "status": "fresh",
  "consecutive_failures": 0,
  "feature_count": 3,
  "source_url": "https://ideg.xunta.gal/servizos/rest/services/LimitesAdministrativos/LimitesAdministrativos/MapServer",
  "licence": "CC-BY-SA-4.0",
  "attribution": "© Instituto de Estudos do Territorio. Xunta de Galicia",
  "checksum": "sha256:b69a2c74c7c2bf7326369f9c647e0c558e486d35ca146e43bf105da3b10fc299",
  "last_error": null,
  "history": [
    {
      "at": "2026-10-22T09:21:36.975Z",
      "ok": true
    }
  ]
}