{
  "layer_id": "aeroportos",
  "published_at": "2026-10-28T22:00:00.000Z",
  "fetched_at": "2026-10-29T23:37:50.364Z",
  "last_success_at": "2026-10-29T23:37:50.364Z",
  "status": "fresh",
  "consecutive_failures": 0,
  "feature_count": 40,
  "source_url": "https://davidmegginson.github.io/ourairports-data/airports.csv",
  "licence": "https://ourairports.com/data/",
  "attribution": "OurAirports (dominio público); pasaxeiros: Eurostat (avia_paoa)",
  "checksum": "sha256:9ad39f9f2c08c108d729015ff8860ac8fdd7b8b051d17cd75c2b3528b8e27902",
  "last_error": null,
  "history": [
    {
      "at": "2026-10-29T23:37:50.364Z",
      "ok": true
    },
    {
      "at": "2026-10-28T21:44:35.287Z",
      "ok": true
    },
    {
      "at": "2026-10-27T20:51:36.039Z",
      "ok": true
    },
    {
      "at": "2026-10-26T17:01:13.439Z",
      "ok": true
    },
    {
      "at": "2026-10-25T11:34:02.201Z",
      "ok": true
    },
    {
      "at": "2026-10-25T11:26:10.782Z",
      "ok": true
    },
    {
      "at": "2026-10-25T11:10:58.000Z",
      "ok": true
    },
    {
      "at": "2026-10-25T09:21:43.743Z",
      "ok": true
    },
    {
      "at": "2026-10-24T09:06:18.821Z",
      "ok": true
    },
    {
      "at": "2026-10-24T07:54:03.142Z",
      "ok": true
    }
  ]
}
