{
  "layer_id": "perfil-concellos",
  "published_at": "2026-10-25T11:36:35.548Z",
  "fetched_at": "2026-10-25T11:39:01.940Z",
  "last_success_at": "2026-10-25T11:39:01.940Z",
  "status": "fresh",
  "consecutive_failures": 0,
  "feature_count": 313,
  "source_url": "https://agora.galiciasustentable.org",
  "licence": "CC-BY-SA-4.0",
  "attribution": "Cálculo propio da Fundación Galicia Sustentable con datos de: © Instituto de Estudos do Territorio. Xunta de Galicia (PBA); Xunta de Galicia. Consellería de Sanidade — Servizo Galego de Saúde (SERGAS); Consellería de Educación (abertos.xunta.gal, conxunto 0257).",
  "checksum": "sha256:8dfadf58a98d015c4f19746e17334fe74fd25178b3b04bd86bf29e20d88efbf1",
  "last_error": null,
  "history": [
    {
      "at": "2026-10-25T11:39:01.940Z",
      "ok": true
    }
  ]
}
