{
  "layer_id": "calidade-aire",
  "published_at": "2026-10-23T20:00:00.000Z",
  "fetched_at": "2026-10-23T20:30:10.265Z",
  "last_success_at": "2026-10-23T20:30:10.265Z",
  "status": "fresh",
  "consecutive_failures": 0,
  "feature_count": 46,
  "source_url": "https://servizos.meteogalicia.gal/mgrss/caire/jsonICAActual.action",
  "licence": "CC-BY-SA-4.0",
  "attribution": "Datos: Rede de Calidade do Aire de Galicia, MeteoGalicia (Xunta de Galicia). Datos provisionais, non validados.",
  "checksum": "sha256:a69a94c40feb0eb0585f9654fed467618b9e9300718e98073a1c4c0a1b4de694",
  "last_error": null,
  "history": [
    {
      "at": "2026-10-23T20:30:10.265Z",
      "ok": true
    },
    {
      "at": "2026-10-23T17:16:50.289Z",
      "ok": true
    },
    {
      "at": "2026-10-23T12:18:56.266Z",
      "ok": true
    },
    {
      "at": "2026-10-23T06:55:08.295Z",
      "ok": true
    },
    {
      "at": "2026-10-23T01:57:07.946Z",
      "ok": true
    },
    {
      "at": "2026-10-22T23:40:04.991Z",
      "ok": true
    },
    {
      "at": "2026-10-22T20:47:30.426Z",
      "ok": true
    },
    {
      "at": "2026-10-22T17:39:24.994Z",
      "ok": true
    },
    {
      "at": "2026-10-22T12:40:23.764Z",
      "ok": true
    },
    {
      "at": "2026-10-22T06:53:08.158Z",
      "ok": true
    },
    {
      "at": "2026-10-22T01:55:19.466Z",
      "ok": true
    },
    {
      "at": "2026-10-21T23:43:40.092Z",
      "ok": true
    },
    {
      "at": "2026-10-21T20:49:06.581Z",
      "ok": true
    },
    {
      "at": "2026-10-21T17:28:26.207Z",
      "ok": true
    },
    {
      "at": "2026-10-21T12:20:43.004Z",
      "ok": true
    },
    {
      "at": "2026-10-21T06:37:37.567Z",
      "ok": true
    },
    {
      "at": "2026-10-21T01:47:19.943Z",
      "ok": true
    },
    {
      "at": "2026-10-20T23:23:29.097Z",
      "ok": true
    },
    {
      "at": "2026-10-20T20:38:15.433Z",
      "ok": true
    },
    {
      "at": "2026-10-20T17:14:31.570Z",
      "ok": true
    },
    {
      "at": "2026-10-20T12:16:02.815Z",
      "ok": true
    },
    {
      "at": "2026-10-20T06:40:28.153Z",
      "ok": true
    },
    {
      "at": "2026-10-20T01:43:42.282Z",
      "ok": true
    },
    {
      "at": "2026-10-19T23:03:14.335Z",
      "ok": true
    },
    {
      "at": "2026-10-19T19:30:33.988Z",
      "ok": true
    },
    {
      "at": "2026-10-19T13:46:35.438Z",
      "ok": true
    },
    {
      "at": "2026-10-19T06:26:20.327Z",
      "ok": true
    },
    {
      "at": "2026-10-19T01:20:32.379Z",
      "ok": true
    },
    {
      "at": "2026-10-18T23:16:24.250Z",
      "ok": true
    },
    {
      "at": "2026-10-18T21:12:26.205Z",
      "ok": true
    },
    {
      "at": "2026-10-18T18:20:08.517Z",
      "ok": true
    },
    {
      "at": "2026-10-18T16:39:44.231Z",
      "ok": true
    },
    {
      "at": "2026-10-18T13:21:17.599Z",
      "ok": true
    },
    {
      "at": "2026-10-18T10:33:26.521Z",
      "ok": true
    },
    {
      "at": "2026-10-18T09:15:56.624Z",
      "ok": true
    }
  ]
}
