{
  "layer_id": "perimetros-queimados",
  "published_at": "2026-10-19T13:19:12.428Z",
  "fetched_at": "2026-10-25T11:16:08.338Z",
  "last_success_at": "2026-10-25T11:16:08.338Z",
  "status": "fresh",
  "consecutive_failures": 0,
  "feature_count": 176,
  "source_url": "https://maps.effis.emergency.copernicus.eu/effis?service=WFS&request=GetFeature&version=2.0.0&typeNames=ms:modis.ba.poly.season&outputFormat=geojson&bbox=41.8,-9.35,43.8,-6.7,urn:ogc:def:crs:EPSG::4326",
  "licence": "CC-BY-4.0",
  "attribution": "© Unión Europea, Copernicus EFFIS (JRC)",
  "checksum": "sha256:5a4f2c11bcbf3f55d2a1e7603abae45ce75e20b8463c113c0c08b0c7beb7944f",
  "last_error": null,
  "history": [
    {
      "at": "2026-10-25T11:16:08.338Z",
      "ok": true
    },
    {
      "at": "2026-10-25T09:22:36.029Z",
      "ok": true
    },
    {
      "at": "2026-10-24T09:09:29.168Z",
      "ok": true
    },
    {
      "at": "2026-10-24T07:54:55.546Z",
      "ok": true
    },
    {
      "at": "2026-10-24T07:32:52.042Z",
      "ok": true
    },
    {
      "at": "2026-10-23T20:30:13.840Z",
      "ok": true
    },
    {
      "at": "2026-10-22T17:39:28.118Z",
      "ok": true
    },
    {
      "at": "2026-10-21T17:28:28.689Z",
      "ok": true
    },
    {
      "at": "2026-10-20T17:14:37.272Z",
      "ok": true
    },
    {
      "at": "2026-10-19T13:46:38.221Z",
      "ok": true
    }
  ]
}
