{
  "layer_id": "buses-xunta",
  "published_at": "2026-10-23T19:29:27.000Z",
  "fetched_at": "2026-10-25T09:21:46.890Z",
  "last_success_at": "2026-10-25T09:21:46.890Z",
  "status": "fresh",
  "consecutive_failures": 0,
  "feature_count": 25118,
  "source_url": "https://nap.transportes.gob.es/api/Fichero/download/1584",
  "licence": "https://nap.transportes.gob.es/licencia-datos",
  "attribution": "Fonte: Xunta de Galicia, vía Punto de Acceso Nacional (MITRAMS). Powered by MITRAMS",
  "checksum": "sha256:29c51b6e64a18daa454eb8abc5e5af9ac236d0f4107c8203f4688f0e051d1ebf",
  "last_error": null,
  "history": [
    {
      "at": "2026-10-25T09:21:46.890Z",
      "ok": true
    },
    {
      "at": "2026-10-24T09:06:20.789Z",
      "ok": true
    },
    {
      "at": "2026-10-24T07:54:05.229Z",
      "ok": true
    },
    {
      "at": "2026-10-24T07:32:10.817Z",
      "ok": true
    }
  ]
}
