{
  "layer_id": "avisos-meteogalicia",
  "published_at": null,
  "fetched_at": "2026-10-27T00:46:47.681Z",
  "last_success_at": "2026-10-27T00:46:47.681Z",
  "status": "fresh",
  "consecutive_failures": 0,
  "feature_count": 313,
  "source_url": "https://servizos.meteogalicia.gal/mgrss/predicion/adversos/jsonConcellosNivelMax.action",
  "licence": "CC-BY-SA-4.0",
  "attribution": "Datos: MeteoGalicia (Xunta de Galicia)",
  "checksum": "sha256:b0d3259a42f56a43a11eff1268cfdbc5e2c722c39da0f71071f3559ef3833aac",
  "last_error": null,
  "history": [
    {
      "at": "2026-10-27T00:46:47.681Z",
      "ok": true
    },
    {
      "at": "2026-10-26T21:36:17.550Z",
      "ok": true
    },
    {
      "at": "2026-10-26T20:43:03.838Z",
      "ok": true
    },
    {
      "at": "2026-10-26T17:01:14.711Z",
      "ok": true
    },
    {
      "at": "2026-10-26T10:40:34.011Z",
      "ok": true
    },
    {
      "at": "2026-10-26T04:52:00.626Z",
      "ok": true
    },
    {
      "at": "2026-10-26T00:11:45.716Z",
      "ok": true
    },
    {
      "at": "2026-10-25T22:05:40.236Z",
      "ok": true
    },
    {
      "at": "2026-10-25T19:40:39.443Z",
      "ok": true
    },
    {
      "at": "2026-10-25T18:28:20.805Z",
      "ok": true
    },
    {
      "at": "2026-10-25T17:15:24.814Z",
      "ok": true
    },
    {
      "at": "2026-10-25T14:38:45.374Z",
      "ok": true
    },
    {
      "at": "2026-10-25T13:48:34.811Z",
      "ok": true
    },
    {
      "at": "2026-10-25T12:29:34.124Z",
      "ok": true
    },
    {
      "at": "2026-10-25T11:34:05.962Z",
      "ok": true
    },
    {
      "at": "2026-10-25T11:26:12.594Z",
      "ok": true
    },
    {
      "at": "2026-10-25T11:11:02.691Z",
      "ok": true
    },
    {
      "at": "2026-10-25T09:21:45.389Z",
      "ok": true
    },
    {
      "at": "2026-10-25T04:31:33.756Z",
      "ok": true
    },
    {
      "at": "2026-10-25T00:05:37.572Z",
      "ok": true
    },
    {
      "at": "2026-10-24T21:59:32.742Z",
      "ok": true
    },
    {
      "at": "2026-10-24T19:50:12.361Z",
      "ok": true
    },
    {
      "at": "2026-10-24T17:44:05.622Z",
      "ok": true
    },
    {
      "at": "2026-10-24T14:50:30.366Z",
      "ok": true
    },
    {
      "at": "2026-10-24T11:32:16.766Z",
      "ok": true
    },
    {
      "at": "2026-10-24T09:06:19.773Z",
      "ok": true
    },
    {
      "at": "2026-10-24T07:54:04.188Z",
      "ok": true
    }
  ]
}
