{
  "layer_id": "estacions-meteo",
  "published_at": "2026-10-24T07:20:00.000Z",
  "fetched_at": "2026-10-24T07:32:49.397Z",
  "last_success_at": "2026-10-24T07:32:49.397Z",
  "status": "fresh",
  "consecutive_failures": 0,
  "feature_count": 154,
  "source_url": "https://servizos.meteogalicia.gal/mgrss/observacion/ultimos10minEstacionsMeteo.action",
  "licence": "CC-BY-SA-4.0",
  "attribution": "Datos: MeteoGalicia (Xunta de Galicia)",
  "checksum": "sha256:fbbb2deadc4cfc44dfa7532ad2a80f2eeb7e980bab0ef27894885ac16ec5d4be",
  "last_error": null,
  "history": [
    {
      "at": "2026-10-24T07:32:49.397Z",
      "ok": true
    },
    {
      "at": "2026-10-24T06:31:11.827Z",
      "ok": true
    },
    {
      "at": "2026-10-24T01:45:38.011Z",
      "ok": true
    },
    {
      "at": "2026-10-23T23:22:44.404Z",
      "ok": true
    },
    {
      "at": "2026-10-23T20:30:11.885Z",
      "ok": true
    },
    {
      "at": "2026-10-23T17:16:51.469Z",
      "ok": true
    },
    {
      "at": "2026-10-23T12:18:59.957Z",
      "ok": true
    },
    {
      "at": "2026-10-23T06:55:09.426Z",
      "ok": true
    },
    {
      "at": "2026-10-23T01:57:09.149Z",
      "ok": true
    },
    {
      "at": "2026-10-22T23:40:06.284Z",
      "ok": true
    },
    {
      "at": "2026-10-22T20:47:31.935Z",
      "ok": true
    },
    {
      "at": "2026-10-22T17:39:26.199Z",
      "ok": true
    },
    {
      "at": "2026-10-22T12:40:24.919Z",
      "ok": true
    },
    {
      "at": "2026-10-22T06:53:09.637Z",
      "ok": true
    },
    {
      "at": "2026-10-22T01:55:21.284Z",
      "ok": true
    },
    {
      "at": "2026-10-21T23:43:41.218Z",
      "ok": true
    },
    {
      "at": "2026-10-21T20:49:09.044Z",
      "ok": true
    },
    {
      "at": "2026-10-21T17:28:27.409Z",
      "ok": true
    },
    {
      "at": "2026-10-21T12:20:44.545Z",
      "ok": true
    },
    {
      "at": "2026-10-21T06:37:39.421Z",
      "ok": true
    },
    {
      "at": "2026-10-21T01:47:21.303Z",
      "ok": true
    },
    {
      "at": "2026-10-20T23:23:30.251Z",
      "ok": true
    },
    {
      "at": "2026-10-20T20:38:17.081Z",
      "ok": true
    },
    {
      "at": "2026-10-20T17:14:35.101Z",
      "ok": true
    },
    {
      "at": "2026-10-20T12:16:04.745Z",
      "ok": true
    },
    {
      "at": "2026-10-20T06:40:30.012Z",
      "ok": true
    },
    {
      "at": "2026-10-20T01:43:43.694Z",
      "ok": true
    },
    {
      "at": "2026-10-19T23:03:17.003Z",
      "ok": true
    },
    {
      "at": "2026-10-19T19:30:35.793Z",
      "ok": true
    },
    {
      "at": "2026-10-19T13:46:37.062Z",
      "ok": true
    },
    {
      "at": "2026-10-19T06:26:22.433Z",
      "ok": true
    },
    {
      "at": "2026-10-19T01:20:34.223Z",
      "ok": true
    },
    {
      "at": "2026-10-18T23:16:25.880Z",
      "ok": true
    },
    {
      "at": "2026-10-18T21:12:27.757Z",
      "ok": true
    },
    {
      "at": "2026-10-18T19:05:27.333Z",
      "ok": true
    },
    {
      "at": "2026-10-18T18:20:10.038Z",
      "ok": true
    },
    {
      "at": "2026-10-18T16:39:46.079Z",
      "ok": true
    },
    {
      "at": "2026-10-18T13:21:19.255Z",
      "ok": true
    },
    {
      "at": "2026-10-18T11:09:24.137Z",
      "ok": true
    },
    {
      "at": "2026-10-18T10:33:39.428Z",
      "ok": true
    },
    {
      "at": "2026-10-18T09:16:08.022Z",
      "ok": true
    }
  ]
}
