{
  "layer_id": "rede-natura",
  "published_at": null,
  "fetched_at": "2026-10-25T11:39:07.091Z",
  "last_success_at": "2026-10-18T09:03:21.597Z",
  "status": "stale",
  "consecutive_failures": 7,
  "feature_count": 76,
  "source_url": "https://geoserver.iepnb.es/geoserver/RN2000/ows",
  "licence": "https://www.miteco.gob.es/es/atencion-al-ciudadano/aviso-legal.html",
  "attribution": "Fuente: MITECO, Banco de Datos de la Naturaleza",
  "checksum": "sha256:302244ac1781a3ee068ae74ef481c42043fe0448181a10201a6ede29f4427cc2",
  "last_error": "HTTP 403 for https://geoserver.iepnb.es/geoserver/RN2000/ows?service=WFS&version=2.0.0&request=GetCapabilities",
  "history": [
    {
      "at": "2026-10-25T11:39:07.091Z",
      "ok": false,
      "error": "HTTP 403 for https://geoserver.iepnb.es/geoserver/RN2000/ows?service=WFS&version=2.0.0&request=GetCapabilities"
    },
    {
      "at": "2026-10-25T11:31:34.253Z",
      "ok": false,
      "error": "HTTP 403 for https://geoserver.iepnb.es/geoserver/RN2000/ows?service=WFS&version=2.0.0&request=GetCapabilities"
    },
    {
      "at": "2026-10-25T11:16:14.282Z",
      "ok": false,
      "error": "HTTP 403 for https://geoserver.iepnb.es/geoserver/RN2000/ows?service=WFS&version=2.0.0&request=GetCapabilities"
    },
    {
      "at": "2026-10-24T09:09:33.349Z",
      "ok": false,
      "error": "HTTP 403 for https://geoserver.iepnb.es/geoserver/RN2000/ows?service=WFS&version=2.0.0&request=GetCapabilities"
    },
    {
      "at": "2026-10-24T07:55:00.114Z",
      "ok": false,
      "error": "HTTP 403 for https://geoserver.iepnb.es/geoserver/RN2000/ows?service=WFS&version=2.0.0&request=GetCapabilities"
    },
    {
      "at": "2026-10-24T07:32:54.318Z",
      "ok": false,
      "error": "HTTP 403 for https://geoserver.iepnb.es/geoserver/RN2000/ows?service=WFS&version=2.0.0&request=GetCapabilities"
    }
  ]
}
